{
  "$schema": "./schemas/contract-catalog-v3.schema.json",
  "$id": "https://physicistjohn.github.io/tinysa-flasher/contracts/contract-catalog-v3.json",
  "contractId": "tinysa-flasher-contract-catalog",
  "contractVersion": 3,
  "applicationContract": "./flasher-application-v2.json",
  "applicationContractSha256": "e43c12157adbba7315a9056ff306d409782aa1648eca3fe32f5f9ec421dae3ba",
  "interfaceEnvelopeVersion": 3,
  "interfaces": [
    {
      "contractId": "tinysa-flasher-renderer-ipc",
      "contractVersion": 3,
      "path": "./interfaces/renderer-ipc-v3.json",
      "sha256": "98bf76c216491a770ec7de3d930fc0cf07cd52298fb5c4dee081fd5ff6149a08",
      "required": true
    },
    {
      "contractId": "tinysa-flasher-ipc-adapter",
      "contractVersion": 3,
      "path": "./interfaces/ipc-adapter-v3.json",
      "sha256": "44e87d07e9e5ccda53815f483027ae13e682a6913780294be9db7fd087854c55",
      "required": true
    },
    {
      "contractId": "tinysa-flasher-application-facade",
      "contractVersion": 3,
      "path": "./interfaces/application-facade-v3.json",
      "sha256": "081970c74bf6f1a124c236ca40541d9458d34db9fd7e16b139d0adb60580ef68",
      "required": true
    },
    {
      "contractId": "tinysa-flasher-device-cdc",
      "contractVersion": 3,
      "path": "./interfaces/device-cdc-v3.json",
      "sha256": "fc37df2616dd6564429c7ca0835ed835ff10f6e53c51c7bdc819d5bfaa2f6980",
      "required": true
    },
    {
      "contractId": "tinysa-flasher-firmware-updater",
      "contractVersion": 3,
      "path": "./interfaces/firmware-updater-v3.json",
      "sha256": "6caf45d3531bd6958e82cbda11268adbbb881ee2c5755eac2fc2680d6d96e7da",
      "required": true
    },
    {
      "contractId": "tinysa-flasher-runtime-ports",
      "contractVersion": 3,
      "path": "./interfaces/runtime-ports-v3.json",
      "sha256": "dd4a09c410e07543b5ac4d147cf1c234393088c472dd78153c69ded6264af2b9",
      "required": true
    },
    {
      "contractId": "tinysa-flasher-safety-evidence",
      "contractVersion": 3,
      "path": "./interfaces/safety-evidence-v3.json",
      "sha256": "a07b23bb4420a12a69cc37845aacf3b2aa79653da23c1b02852b7af3d5986877",
      "required": true
    },
    {
      "contractId": "tinysa-flasher-local-firmware-build",
      "contractVersion": 3,
      "path": "./interfaces/local-firmware-build-v3.json",
      "sha256": "9e3e399d98e8722841258155639efe99e59eb14ba4016c62703663308c070f53",
      "required": true
    },
    {
      "contractId": "tinysa-flasher-local-firmware-picker",
      "contractVersion": 3,
      "path": "./interfaces/local-firmware-picker-v3.json",
      "sha256": "648bdcae56106e9379f6b4f4f2558bc0eac432d8d39ce0c56d44b256f6cf42bf",
      "required": true
    },
    {
      "contractId": "tinysa-flasher-legacy-migration",
      "contractVersion": 3,
      "path": "./interfaces/legacy-migration-v3.json",
      "sha256": "6010307920c58824b7da64a6a5b38cac837efbee1f1dd06f6604cd4d23afa44a",
      "required": true
    },
    {
      "contractId": "tinysa-flasher-application-config",
      "contractVersion": 3,
      "path": "./interfaces/application-config-v3.json",
      "sha256": "fb94ef9718cc2e22a0c0d65931feb063bed7ae2016c206037fa3d110d8dde61c",
      "required": true
    }
  ]
}
